Title;links
Does the Bank of England have a woman problem? - BBC News;https://www.bbc.co.uk/news/business-48062920
Japan emperor: Why a woman can't take the throne - BBC News;https://www.bbc.co.uk/news/av/world-asia-48034515/japan-emperor-why-a-woman-can-t-take-the-throne
Power restored to most homes hit by Storm Hannah - BBC News;https://www.bbc.co.uk/news/uk-northern-ireland-48052656
Hundreds of thousands of viruses in oceans - BBC News;https://www.bbc.co.uk/news/science-environment-48066332
Failed airline FlyBMI 'owed £37m' when it collapsed, say administrators - BBC News;https://www.bbc.co.uk/news/business-48071724
Beyond Today - What is justice in the age of Trump? - BBC Sounds;https://www.bbc.co.uk/sounds/play/p077kswr
Should the colour of plasters match skin tones? - BBC News;https://www.bbc.co.uk/news/48060767
Taking HIV drug PrEP 'doesn't mean you're promiscuous' - BBC News;https://www.bbc.co.uk/news/uk-wales-47950515
Stormzy: My Glastonbury doubters have 'gone mad' - BBC News;https://www.bbc.co.uk/news/newsbeat-48071113
RG2 - BBC Weather;https://www.bbc.co.uk/weather/rg2/day4
Suffolk Broads gateway restoration work begins - BBC News;https://www.bbc.co.uk/news/uk-england-suffolk-48051836
Fr Martin Magill says NI politicians felt pressure at Lyra McKee funeral - BBC News;https://www.bbc.co.uk/news/uk-northern-ireland-48073396
Man jailed for raping sleep-walking teenager - BBC News;https://www.bbc.co.uk/news/uk-england-berkshire-48070993
Watch live World Snooker Championship from the Crucible in Sheffield - BBC Sport;https://www.bbc.co.uk/sport/live/snooker/47311057
Wigan - BBC Weather;https://www.bbc.co.uk/weather/2633948
BBC One - Earth from Space;https://www.bbc.co.uk/programmes/p072n2zr
Wareham toddler death lorry driver cleared of charge - BBC News;https://www.bbc.co.uk/news/uk-england-dorset-48052897
Watermelon recipes - BBC Food;https://www.bbc.com/food/watermelon
Lawro's Premier League predictions v Radio 1 DJ Melvin Odoom - BBC Sport;https://www.bbc.co.uk/sport/football/48053764
Raheem Sterling: Manchester City forward wins award for stance against racism - BBC Sport;https://www.bbc.co.uk/sport/football/48060828
